{
  "schemaVersion": 1,
  "id": "xyflow-react-movinghandles",
  "library": "xyflow",
  "kind": "xyflow-flow",
  "title": "xyflow example fixture for examples.react-movinghandles",
  "input": {
    "nodes": [
      {
        "id": "input",
        "type": "input",
        "position": {
          "x": -300,
          "y": 0
        },
        "data": {
          "label": "input"
        },
        "sourcePosition": "right"
      }
    ],
    "edges": [],
    "viewport": {
      "x": 0,
      "y": 0,
      "zoom": 1
    },
    "flowOptions": {
      "fitView": true
    }
  },
  "pixelThreshold": {
    "maxMismatchRatio": 0.01,
    "perChannelDelta": 8
  },
  "extraction": {
    "status": "extracted",
    "source": ".ds-scrap/re-sources/xyflow/examples/react/src/examples/MovingHandles/index.tsx"
  }
}
