{
  "schemaVersion": 1,
  "id": "xyflow-react-a11y",
  "library": "xyflow",
  "kind": "xyflow-flow",
  "title": "xyflow example fixture for examples.react-a11y",
  "input": {
    "nodes": [
      {
        "id": "1",
        "type": "input",
        "position": {
          "x": 250,
          "y": 5
        },
        "data": {
          "label": "A11y Node 1"
        },
        "className": "light"
      },
      {
        "id": "2",
        "type": "default",
        "position": {
          "x": 1000,
          "y": 100
        },
        "data": {
          "label": "Node 2"
        }
      },
      {
        "id": "3",
        "type": "default",
        "position": {
          "x": 100,
          "y": 100
        },
        "data": {
          "label": "Node 3"
        },
        "className": "light"
      },
      {
        "id": "4",
        "type": "default",
        "position": {
          "x": 300,
          "y": 100
        },
        "data": {
          "label": "Node 4"
        }
      },
      {
        "id": "5",
        "type": "default",
        "position": {
          "x": 400,
          "y": 200
        },
        "data": {
          "label": "Node 5"
        }
      },
      {
        "id": "6",
        "type": "default",
        "position": {
          "x": -1000,
          "y": 200
        },
        "data": {
          "label": "Node 6"
        }
      }
    ],
    "edges": [
      {
        "id": "e1-2",
        "source": "1",
        "target": "2",
        "animated": true
      },
      {
        "id": "e1-3",
        "source": "1",
        "target": "3"
      },
      {
        "id": "e1-4",
        "source": "1",
        "target": "4"
      },
      {
        "id": "e1-5",
        "source": "4",
        "target": "5"
      },
      {
        "id": "e1-6",
        "source": "3",
        "target": "6"
      }
    ],
    "viewport": {
      "x": 0,
      "y": 0,
      "zoom": 1
    }
  },
  "pixelThreshold": {
    "maxMismatchRatio": 0.01,
    "perChannelDelta": 8
  },
  "extraction": {
    "status": "extracted",
    "source": ".ds-scrap/re-sources/xyflow/examples/react/src/examples/A11y/index.tsx"
  }
}
