{
  "schemaVersion": 1,
  "id": "xyflow-react-edgetypes",
  "library": "xyflow",
  "kind": "xyflow-flow",
  "title": "xyflow example fixture for examples.react-edgetypes",
  "input": {
    "nodes": [],
    "edges": [],
    "viewport": {
      "x": 0,
      "y": 0,
      "zoom": 1
    }
  },
  "pixelThreshold": {
    "maxMismatchRatio": 0.01,
    "perChannelDelta": 8
  },
  "extraction": {
    "status": "unknown",
    "cause": "initial graph is not a pure data literal (utils.ts: non-literal nodeGapWidth)",
    "source": ".ds-scrap/re-sources/xyflow/examples/react/src/examples/EdgeTypes/index.tsx"
  }
}
