{
  "schemaVersion": 1,
  "id": "xyflow-react-basic",
  "library": "xyflow",
  "kind": "xyflow-flow",
  "title": "xyflow example fixture for examples.react-basic",
  "input": {
    "nodes": [
      {
        "id": "1",
        "type": "input",
        "position": {
          "x": 250,
          "y": 5
        },
        "data": {
          "label": "Node 1"
        },
        "className": "light"
      },
      {
        "id": "2",
        "type": "default",
        "position": {
          "x": 100,
          "y": 100
        },
        "data": {
          "label": "Node 2"
        },
        "className": "light"
      },
      {
        "id": "3",
        "type": "default",
        "position": {
          "x": 400,
          "y": 100
        },
        "data": {
          "label": "Node 3"
        },
        "className": "light"
      },
      {
        "id": "4",
        "type": "default",
        "position": {
          "x": 400,
          "y": 200
        },
        "data": {
          "label": "Node 4"
        },
        "className": "light"
      }
    ],
    "edges": [
      {
        "id": "e1-2",
        "source": "1",
        "target": "2",
        "animated": true
      },
      {
        "id": "e1-3",
        "source": "1",
        "target": "3"
      }
    ],
    "viewport": {
      "x": 0,
      "y": 0,
      "zoom": 1
    },
    "flowOptions": {
      "fitView": true
    }
  },
  "pixelThreshold": {
    "maxMismatchRatio": 0.01,
    "perChannelDelta": 8
  },
  "extraction": {
    "status": "extracted",
    "source": ".ds-scrap/re-sources/xyflow/examples/react/src/examples/Basic/index.tsx"
  }
}
