{
  "schemaVersion": 1,
  "id": "xyflow-react-customnode",
  "library": "xyflow",
  "kind": "xyflow-flow",
  "title": "xyflow example fixture for examples.react-customnode",
  "input": {
    "nodes": [],
    "edges": [],
    "viewport": {
      "x": 0,
      "y": 0,
      "zoom": 1
    }
  },
  "pixelThreshold": {
    "maxMismatchRatio": 0.01,
    "perChannelDelta": 8
  },
  "extraction": {
    "status": "unknown",
    "cause": "no initial nodes array literal found in the example sources (graph is computed, imported, or built by interaction callbacks)",
    "source": ".ds-scrap/re-sources/xyflow/examples/react/src/examples/CustomNode/ColorSelectorNode.tsx"
  }
}
