{
  "schemaVersion": 1,
  "id": "xyflow-react-edgerenderer",
  "library": "xyflow",
  "kind": "xyflow-flow",
  "title": "xyflow example fixture for examples.react-edgerenderer",
  "input": {
    "nodes": [
      {
        "id": "1",
        "type": "input",
        "position": {
          "x": 250,
          "y": 0
        },
        "data": {
          "label": "Input 1"
        }
      },
      {
        "id": "2",
        "type": "default",
        "position": {
          "x": 150,
          "y": 100
        },
        "data": {
          "label": "Node 2"
        }
      },
      {
        "id": "2a",
        "type": "default",
        "position": {
          "x": 0,
          "y": 180
        },
        "data": {
          "label": "Node 2a"
        }
      },
      {
        "id": "2b",
        "type": "default",
        "position": {
          "x": -40,
          "y": 300
        },
        "data": {
          "label": "Node 2b"
        }
      },
      {
        "id": "3",
        "type": "default",
        "position": {
          "x": 250,
          "y": 200
        },
        "data": {
          "label": "Node 3"
        }
      },
      {
        "id": "4",
        "type": "default",
        "position": {
          "x": 400,
          "y": 300
        },
        "data": {
          "label": "Node 4"
        }
      },
      {
        "id": "3a",
        "type": "default",
        "position": {
          "x": 150,
          "y": 300
        },
        "data": {
          "label": "Node 3a"
        }
      },
      {
        "id": "5",
        "type": "default",
        "position": {
          "x": 250,
          "y": 400
        },
        "data": {
          "label": "Node 5"
        }
      },
      {
        "id": "6",
        "type": "output",
        "position": {
          "x": 50,
          "y": 550
        },
        "data": {
          "label": "Output 6"
        }
      },
      {
        "id": "7",
        "type": "output",
        "position": {
          "x": 250,
          "y": 550
        },
        "data": {
          "label": "Output 7"
        }
      },
      {
        "id": "8",
        "type": "output",
        "position": {
          "x": 525,
          "y": 600
        },
        "data": {
          "label": "Output 8"
        }
      },
      {
        "id": "9",
        "type": "output",
        "position": {
          "x": 675,
          "y": 500
        },
        "data": {
          "label": "Output 9"
        }
      }
    ],
    "edges": [],
    "viewport": {
      "x": 0,
      "y": 0,
      "zoom": 1
    }
  },
  "pixelThreshold": {
    "maxMismatchRatio": 0.01,
    "perChannelDelta": 8
  },
  "extraction": {
    "status": "extracted",
    "source": ".ds-scrap/re-sources/xyflow/examples/react/src/examples/EdgeRenderer/index.tsx"
  }
}
