{
  "schemaVersion": 1,
  "id": "xyflow-svelte-node-resizer",
  "library": "xyflow",
  "kind": "xyflow-flow",
  "title": "xyflow example fixture for examples.svelte-node-resizer",
  "input": {
    "nodes": [],
    "edges": [],
    "viewport": {
      "x": 0,
      "y": 0,
      "zoom": 1
    }
  },
  "pixelThreshold": {
    "maxMismatchRatio": 0.01,
    "perChannelDelta": 8
  },
  "extraction": {
    "status": "unknown",
    "cause": "custom node/edge types (bottomRightResizer, customResizer, defaultResizer, fixedExtent, horizontalResizer, verticalResizer) are application components, not data: mounted without them the library falls back to its default type, so the fixture would not reproduce the example",
    "source": ".ds-scrap/re-sources/xyflow/examples/svelte/src/routes/examples/node-resizer/+page.svelte",
    "customTypes": [
      "bottomRightResizer",
      "customResizer",
      "defaultResizer",
      "fixedExtent",
      "horizontalResizer",
      "verticalResizer"
    ]
  }
}
