{
  "schemaVersion": 1,
  "id": "xyflow-react-defaultedgeoverwrite",
  "library": "xyflow",
  "kind": "xyflow-flow",
  "title": "xyflow example fixture for examples.react-defaultedgeoverwrite",
  "input": {
    "nodes": [],
    "edges": [],
    "viewport": {
      "x": 0,
      "y": 0,
      "zoom": 1
    }
  },
  "pixelThreshold": {
    "maxMismatchRatio": 0.01,
    "perChannelDelta": 8
  },
  "extraction": {
    "status": "unknown",
    "cause": "custom node/edge types (unregistered) are application components, not data: mounted without them the library falls back to its default type, so the fixture would not reproduce the example",
    "source": ".ds-scrap/re-sources/xyflow/examples/react/src/examples/DefaultEdgeOverwrite/index.tsx",
    "customTypes": [
      "unregistered"
    ]
  }
}
