{
  "schemaVersion": 1,
  "id": "xyflow-svelte-usesvelteflow",
  "library": "xyflow",
  "kind": "xyflow-flow",
  "title": "xyflow example fixture for examples.svelte-usesvelteflow",
  "input": {
    "nodes": [
      {
        "id": "1",
        "type": "input",
        "position": {
          "x": 150,
          "y": 5
        },
        "data": {
          "label": "Input Node"
        }
      },
      {
        "id": "2",
        "type": "default",
        "position": {
          "x": 0,
          "y": 150
        },
        "data": {
          "label": "Node"
        }
      },
      {
        "id": "3",
        "type": "output",
        "position": {
          "x": 300,
          "y": 150
        },
        "data": {
          "label": "Output Node"
        }
      }
    ],
    "edges": [
      {
        "id": "1-2",
        "source": "1",
        "target": "2",
        "type": "default",
        "label": "Edge Text"
      },
      {
        "id": "1-3",
        "source": "1",
        "target": "3",
        "type": "smoothstep"
      }
    ],
    "viewport": {
      "x": 0,
      "y": 0,
      "zoom": 1
    },
    "flowOptions": {
      "fitView": true
    }
  },
  "pixelThreshold": {
    "maxMismatchRatio": 0.01,
    "perChannelDelta": 8
  },
  "extraction": {
    "status": "extracted",
    "source": ".ds-scrap/re-sources/xyflow/examples/svelte/src/routes/examples/usesvelteflow/Flow.svelte"
  }
}
